id;guid;inn;kpp;url;ogrn;okfs;phone;ogrnip;orgOid;bankCode;fullName;orgEmail;shortName;orgAddress;chiefLastName;chiefFirstName;chiefMiddleName;organizationType
383;f61935c6-fb25-4606-8033-a24990a0c7b1;2130205588;213001001;достояние-наследие.рф;1182130011436;;78352259233;;1086452964;;ОБЩЕСТВО С ОГРАНИЧЕННОЙ ОТВЕТСТВЕННОСТЬЮ ДОСТОЯНИЕ;mail@достояние-наследие.рф;ООО ДОСТОЯНИЕ;428028, ЧУВАШИЯ ЧУВАШСКАЯ РЕСПУБЛИКА -, ГОРОД ЧЕБОКСАРЫ, ПРОСПЕКТ ТРАКТОРОСТРОИТЕЛЕЙ, д. ДОМ 69Б, кв. ОФИС 27;Павлов;Валерий;Аркадьевич;L
384;a767af81-dc09-4ca9-b42e-708b5a8aef24;2130153925;213001001;;1152130005730;;78352533807;;1080784278;;ОБЩЕСТВО С ОГРАНИЧЕННОЙ ОТВЕТСТВЕННОСТЬЮ УПРАВЛЯЮЩАЯ КОМПАНИЯ МАСТЕР;uk2018master@yandex.ru;ООО УК МАСТЕР;428028, ЧУВАШИЯ ЧУВАШСКАЯ РЕСПУБЛИКА -, ГОРОД ЧЕБОКСАРЫ, ПРОСПЕКТ ТРАКТОРОСТРОИТЕЛЕЙ, д. ДОМ 63/21, кв. ПОМЕЩЕНИЕ 7;Антонов;Сергей;Григорьевич;L
385;ec015435-7485-42ca-b02e-78abd9da6181;2127330042;213001001;;1042127004897;;78352257292;;1012171577;;ТОВАРИЩЕСТВО СОБСТВЕННИКОВ ЖИЛЬЯ РАССВЕТ;r.rasswet@yandex.ru;ТСЖ РАССВЕТ;428028, Чувашская Республика Чувашия, г Чебоксары, пр-кт Тракторостроителей, д. 58;Покровская;Зоя;Валериановна;L
386;f5a3b05d-4557-4130-af77-224845dd76f5;2130003415;213001001;;1062130006278;;+7(835)264-71-39;;1006606967;;ОБЩЕСТВО С ОГРАНИЧЕННОЙ ОТВЕТСТВЕННОСТЬЮ УПРАВЛЯЮЩАЯ ОРГАНИЗАЦИЯ КОЛОСС;uokoloss@yandex.ru;ООО УО КОЛОСС;428028, ЧУВАШИЯ ЧУВАШСКАЯ РЕСПУБЛИКА -, ГОРОД ЧЕБОКСАРЫ, ПРОСПЕКТ ТРАКТОРОСТРОИТЕЛЕЙ, д. 66, кв. 123;Потапов;Алексей;Васильевич;L
387;05a47fff-bc0b-45ad-b9f6-f04ef6a4b952;2130055269;213001001;GOGSK@RAMBLER.RU;1092130003140;;78352456615;;1014051584;;ТОВАРИЩЕСТВО СОБСТВЕННИКОВ ЖИЛЬЯ УДАЧА;GOGSK@RAMBLER.RU;ТСЖ УДАЧА;428038, Чувашская Республика Чувашия, г Чебоксары, ул Тополиная, д. 11;Федотова;Татьяна;Юрьевна;L
388;9634a189-24ea-449f-9ea9-bdcb43cbb3ff;2129063032;213001001;;1052128137170;;78352456615;;1014165592;;ТОВАРИЩЕСТВО СОБСТВЕННИКОВ ЖИЛЬЯ ФОНТАН-1;GOGSK@RAMBLER.RU;ТСЖ ФОНТАН-1;428006, ЧУВАШИЯ ЧУВАШСКАЯ РЕСПУБЛИКА -, ГОРОД ЧЕБОКСАРЫ, УЛИЦА ТОПОЛИНАЯ, д. 13;Довыденко;Александр;Петрович;L
389;c443fac6-b5a3-4c3f-b750-f532e2fe281b;2113003327;211301001;http://gov.cap.ru/Default.aspx?gov_id=441;1052138008174;;+7(83543)38337;;1007961418;;АДМИНИСТРАЦИЯ ОКТЯБРЬСКОГО СЕЛЬСКОГО ПОСЕЛЕНИЯ;porezk_sao-okt@cap.ru;АДМИНИСТРАЦИЯ ОКТЯБРЬСКОГО СЕЛЬСКОГО ПОСЕЛЕНИЯ;429025, ЧУВАШИЯ ЧУВАШСКАЯ РЕСПУБЛИКА -, РАЙОН ПОРЕЦКИЙ, СЕЛО АНТИПИНКА, УЛИЦА ТРАКТОРНАЯ, д. 5;Черепков;Александр;Николаевич;A
390;cb4f3b76-cf6e-41b5-abe8-96d1d648e2cf;2130040671;213001001;;1082130007409;;78352456608;;1013932844;;ЖИЛИЩНО-СТРОИТЕЛЬНЫЙ КООПЕРАТИВ ПРОМСТРОЙ;GOGSK@RAMBLER.RU;ЖСК ПРОМСТРОЙ;428017, Чувашская Республика Чувашия, г Чебоксары, ул Т.Кривова, д. 5;Валентинов;Лев;Владимирович;L
391;0dd5a46d-7c1d-4c5f-95a2-0d4b4d5700d0;2130056640;213001001;;1092130004460;;78352456618;;1014054265;;ТОВАРИЩЕСТВО СОБСТВЕННИКОВ ЖИЛЬЯ ТРУД;GOGSK@RAMBLER.RU;ТСЖ ТРУД;428017, Чувашская Республика Чувашия, г Чебоксары, ул Т.Кривова, д. 9;Белова;Татьяна;Леонидовна;L
392;6cce89f4-3b4b-4f70-adb6-c5008ae0cae6;2130040664;213001001;;1082130007420;;78352456618;;1013885935;;ЖИЛИЩНО-СТРОИТЕЛЬНЫЙ КООПЕРАТИВ КОММУНАЛЬНИК;GOGSK@RAMBLER.RU;ЖСК КОММУНАЛЬНИК;428017, Чувашская Республика Чувашия, г Чебоксары, ул Т.Кривова, д. 11;Софронов;Евгений;Леонидович;L
393;69150b74-6b6a-4f89-aa45-6fc777419cf9;2114902454;211401001;http://gov.cap.ru/default.aspx?gov_id=457;1052137020407;;88354421554;;1000385139;;АДМИНИСТРАЦИЯ УРМАРСКОГО ГОРОДСКОГО ПОСЕЛЕНИЯ УРМАРСКОГО РАЙОНА ЧУВАШСКОЙ РЕСПУБЛИКИ;urmary_pos@cap.ru;АДМИНИСТРАЦИЯ УРМАРСКОГО ГОРОДСКОГО ПОСЕЛЕНИЯ;429400, ЧУВАШИЯ ЧУВАШСКАЯ РЕСПУБЛИКА -, Р-Н УРМАРСКИЙ, ПГТ УРМАРЫ, УЛ ЛЕНИНА, д. 13;Павлов;Александр;Витальевич;A
394;cc2c88b6-1c23-43b4-94ff-1a17ad8bf389;2116003886;211601001;;1182130011030;;89063810073;;1081984189;;МУНИЦИПАЛЬНОЕ УНИТАРНОЕ ПРЕДПРИЯТИЕ ЖИЛИЩНО-КОММУНАЛЬНОЕ ХОЗЯЙСТВО ВУРМАН-СЮКТЕРСКОЕ;9063810073@mail.ru;МУП ЖКХ ВУРМАН-СЮКТЕРСКОЕ;429526, ЧУВАШИЯ ЧУВАШСКАЯ РЕСПУБЛИКА -, РАЙОН ЧЕБОКСАРСКИЙ, СЕЛО ХЫРКАСЫ, УЛИЦА РЕСТОРАННАЯ, д. ДОМ 4;Антонов;Игорь;Михайлович;L
395;4ee796fa-bbc2-4efb-94f6-7b5ee01c2f76;2114003672;211401001;;1172130000734;;+7(83544)21657;;1044346026;;МУНИЦИПАЛЬНОЕ УНИТАРНОЕ ПРЕДПРИЯТИЕ УРМАРСКОГО РАЙОНА УРМАРЫВОДХОЗ;urm_vodokanal@cbx.ru;МУП УР УРМАРЫВОДХОЗ;429400, Чувашская Республика Чувашия, Урмарский р-н, пгт Урмары, ул Крупской, д. 4;Орлов;Михаил;Иванович;L
396;39c70a22-3b9e-4d71-bcd5-48a866ed1d63;2114903271;211401001;http://www.jkh.cap.ru/page/orgs/org/567;1082137000032;{'code': '10', 'guid': '341e8e55-4f2e-4ecc-ba90-61d4e58bd4a9', 'name': None, 'level': None, 'actual': None, 'parent': None, 'status': None, 'updDate': None, 'createDate': None, 'hasChildren': None, 'lastUpdateDate': None, 'rootEntityGuid': None};+7(83544)21196;;1006294852;;ОБЩЕСТВО С ОГРАНИЧЕННОЙ ОТВЕТСТВЕННОСТЬЮ УПРАВЛЯЮЩАЯ КОМПАНИЯ ЖИЛИЩНО-КОММУНАЛЬНОГО ХОЗЯЙСТВА УРМАРСКОГО РАЙОНА;urm-gkh2016@yandex.ru;ООО УК ЖКХ УРМАРСКОГО РАЙОНА;429400, ЧУВАШИЯ ЧУВАШСКАЯ РЕСПУБЛИКА -, РАЙОН УРМАРСКИЙ, ПОСЕЛОК ГОРОДСКОГО ТИПА УРМАРЫ, УЛИЦА МИРА, д. 7;Семенова;Светлана;Анатольевна;L
397;8286cc83-8ddc-456c-a769-a17f630932aa;2114903137;211401001;http://gov.cap.ru/HOME/73/www/teploset/index.html;1072137000462;;+7(83544)21805;;1000318061;;МУНИЦИПАЛЬНОЕ УНИТАРНОЕ ПРЕДПРИЯТИЕ УРМАРСКОГО РАЙОНА УРМАРЫТЕПЛОСЕТЬ;urm_teploset@cbx.ru;МУП УР УРМАРЫТЕПЛОСЕТЬ;429400, ЧУВАШИЯ ЧУВАШСКАЯ РЕСПУБЛИКА -, РАЙОН УРМАРСКИЙ, ПОСЕЛОК ГОРОДСКОГО ТИПА УРМАРЫ, УЛИЦА МОЛОДЕЖНАЯ, д. ДОМ 3А;Иванов;Валерий;Александрович;L
398;acab3a76-2f32-4a58-b79c-5ce1e0ec0f01;2106006510;210601001;http://gov.cap.ru/;1052134014349;;79279908615;;1009349634;;АДМИНИСТРАЦИЯ ВУТАБОСИНСКОГО СЕЛЬСКОГО ПОСЕЛЕНИЯ КАНАШСКОГО РАЙОНА ЧУВАШСКОЙ РЕСПУБЛИКИ;kan-vutabos@cap.ru;АДМИНИСТРАЦИЯ ВУТАБОСИНСКОГО СЕЛЬСКОГО ПОСЕЛЕНИЯ КАНАШСКОГО РАЙОНА ЧУВАШСКОЙ РЕСПУБЛИКИ;429304, ЧУВАШИЯ ЧУВАШСКАЯ РЕСПУБЛИКА -, РАЙОН КАНАШСКИЙ, СЕЛО ВУТАБОСИ, УЛИЦА ВОСТОЧНАЯ, д. 21;Петрова;Ираида;Васильевна;A
399;cbd7b1b4-4835-4846-bd32-83f741c3a2a2;2127316680;213001001;;1022100975863;;+79063883878;;1011392744;;ТОВАРИЩЕСТВО СОБСТВЕННИКОВ ЖИЛЬЯ ТСЖ-15;Srz19@mail.ru;ТСЖ-15;428022, Чувашская Республика Чувашия, г Чебоксары, ул Текстильщиков, д. 15;Полтева;Надежда;Петровна;L
400;0e2d77bf-fab8-4f2b-af84-db609f1d3a2d;2127304780;213001001;;1022100983475;;;;1011560133;;ТОВАРИЩЕСТВО СОБСТВЕННИКОВ ЖИЛЬЯ 23;tsg23cheb@mail.ru;ТСЖ 23;428008, ЧУВАШИЯ ЧУВАШСКАЯ РЕСПУБЛИКА -, ГОРОД ЧЕБОКСАРЫ, УЛИЦА ТЕКСТИЛЬЩИКОВ, д. 23, кв. 14;Яковлева;Ирина;Александровна;L
401;60156ad9-b9f3-46d0-b363-fae9a041dd96;2104006498;210401001;http://gov.cap.ru/Default.aspx?gov_id=315&unit=contact;1052133019773;;88353761536;;1008456496;;АДМИНИСТРАЦИЯ БУРТАСИНСКОГО СЕЛЬСКОГО ПОСЕЛЕНИЯ ВУРНАРСКОГО РАЙОНА ЧУВАШСКОЙ РЕСПУБЛИКИ;petr.nikolay2017@yandex.ru;АДМИНИСТРАЦИЯ БУРТАСИНСКОГО СЕЛЬСКОГО ПОСЕЛЕНИЯ ВУРНАРСКОГО РАЙОНА ЧУВАШСКОЙ РЕСПУБЛИКИ;429230, ЧУВАШИЯ ЧУВАШСКАЯ РЕСПУБЛИКА -, Р-Н ВУРНАРСКИЙ, Д БУРТАСЫ, ПЕР ШКОЛЬНЫЙ, д. 1;Петров;Николай;Порфирьевич;A
402;a5e86fbc-eafa-437e-b680-031dce7ec3b5;2128705801;213001001;http://www.jkh.cap.ru/page/orgs/org/40;1052128140613;{'code': '10', 'guid': '341e8e55-4f2e-4ecc-ba90-61d4e58bd4a9', 'name': None, 'level': None, 'actual': None, 'parent': None, 'status': None, 'updDate': None, 'createDate': None, 'hasChildren': None, 'lastUpdateDate': None, 'rootEntityGuid': None};+7(8352)438983;;1006750038;;ОБЩЕСТВО С ОГРАНИЧЕННОЙ ОТВЕТСТВЕННОСТЬЮ УПРАВЛЯЮЩАЯ КОМПАНИЯ ВОЛЖСКИЙ-3;volzhskiy_3@list.ru;ООО УК ВОЛЖСКИЙ-3;428001, ЧУВАШИЯ ЧУВАШСКАЯ РЕСПУБЛИКА -, ГОРОД ЧЕБОКСАРЫ, УЛИЦА СПОРТСМЕНА ВАЛЕРИАНА СОКОЛОВА, д. ДОМ 6, к. КОРПУС 2, кв. ПОМЕЩЕНИЕ №2;Афанасьева;Юлия;Ивановна;L
403;3d7586b1-f204-4e77-aa29-2c8bcbdeba56;2129048997;213001001;;1032129002180;;8(352)45-97-65;;1013172532;;ТОВАРИЩЕСТВО СОБСТВЕННИКОВ ЖИЛЬЯ ТЕРЕМ;teremch@mail.ru;ТСЖ ТЕРЕМ;428015, Чувашская Республика Чувашия, г Чебоксары, ул Спиридона Михайлова, д. 1;Колесников;Евгений;Петрович;L
404;f17d683b-ed62-4dac-ab4d-7ca4f43136ac;2129052778;213001001;;1042129001210;;79051990800;;1040746774;;ТОВАРИЩЕСТВО СОБСТВЕННИКОВ ЖИЛЬЯ СОЦ-2;morgusha1977@rambler.ru;ТСЖ СОЦ-2;428038, Чувашская Республика Чувашия, г Чебоксары, ул Социалистическая, д. 2;Шапошникова;Татьяна;Александровна;L
405;df521da1-9a33-4497-a44d-84403d62f6f0;2127317789;213001001;;1022100987248;;89276686880;;1046483248;;ТОВАРИЩЕСТВО СОБСТВЕННИКОВ ЖИЛЬЯ СОЛЯНОЕ-1;tszh.solyanoe1@mail.ru;ТСЖ СОЛЯНОЕ-1;428022, Чувашская Республика Чувашия, г Чебоксары, проезд Соляное, д. 8;Щербаков;Александр;Николаевич;L
406;94fdae91-93cb-4096-b471-7c05afb8ce0a;2130188741;213001001;http://www.jkh.cap.ru/page/orgs/org/1329;1172130007994;;8-8352-48-20-18;;1052104128;;ОБЩЕСТВО С ОГРАНИЧЕННОЙ ОТВЕТСТВЕННОСТЬЮ УПРАВЛЯЮЩАЯ КОМПАНИЯ СОЛНЕЧНЫЙ;215658@list.ru;ООО УК СОЛНЕЧНЫЙ;428026, ЧУВАШИЯ ЧУВАШСКАЯ РЕСПУБЛИКА -, Г ЧЕБОКСАРЫ, УЛ РОЗЫ ЛЮКСЕМБУРГ, д. ДОМ 9, кв. ПОМЕЩЕНИЕ 4;Марков;Игорь;Николаевич;L
407;4300bbd6-3b33-4c4d-8693-961578fd29ad;2123023481;212301001;альтернатива-канаш.рф;1202100004369;;79279998040;;1130712917;;ОБЩЕСТВО С ОГРАНИЧЕННОЙ ОТВЕТСТВЕННОСТЬЮ УПРАВЛЯЮЩАЯ КОМПАНИЯ АЛЬТЕРНАТИВА;alternativa.23.06.2020@mail.ru;ООО УК АЛЬТЕРНАТИВА;429332, ЧУВАШИЯ ЧУВАШСКАЯ РЕСПУБЛИКА -, ГОРОД КАНАШ, УЛИЦА ТРУДОВАЯ, д. ДОМ 7, кв. КОМНАТА 329;Алексеев;Александр;Владимирович;L
408;27c79384-0a4e-4457-ad4f-b1e8a721f0d7;2123019510;212301001;;1182130000348;;+7(917)6789300;;1073535731;;ОБЩЕСТВО С ОГРАНИЧЕННОЙ ОТВЕТСТВЕННОСТЬЮ УПРАВЛЯЮЩАЯ КОМПАНИЯ ДОМ;kanashmkd@yandex.ru;ООО УК ДОМ;429337, ЧУВАШИЯ ЧУВАШСКАЯ РЕСПУБЛИКА -, ГОРОД КАНАШ, УЛИЦА МАШИНОСТРОИТЕЛЕЙ, д. ДОМ 27, кв. КВАРТИРА 88;Кранцов;Анатолий;Сергеевич;L
409;c8863bae-eccd-43dd-96d5-cdd5044cba30;2118003225;211801001;;1182130009555;;89278412452;;1089374402;;МУНИЦИПАЛЬНОЕ УНИТАРНОЕ ПРЕДПРИЯТИЕ ЮМАНАЙСКОЕ ЖИЛИЩНО-КОММУНАЛЬНОЕ ХОЗЯЙСТВО;kotelnaya71@mail.ru;МУП ЮМАНАЙСКОЕ ЖКХ;429106, ЧУВАШИЯ ЧУВАШСКАЯ РЕСПУБЛИКА -, РАЙОН ШУМЕРЛИНСКИЙ, СЕЛО ЮМАНАЙ, УЛИЦА МИРА, д. ДОМ 5;Миронова;Людмила;Николаевна;L
410;bbb913b2-34d8-4260-8d0d-267ca29c3f75;2123018940;212301001;;1172130008005;;+79677934050, +79677934020;;1058619054;;ОБЩЕСТВО С ОГРАНИЧЕННОЙ ОТВЕТСТВЕННОСТЬЮ ЦЕНТР;ooocentr-kanash@yandex.ru;ООО ЦЕНТР;429330, ЧУВАШИЯ ЧУВАШСКАЯ РЕСПУБЛИКА -, Г КАНАШ, УЛ ЧКАЛОВА, д. ДОМ 9, кв. ОФИС 6;Васильев;Александр;Валерьевич;L
411;444f8424-73ed-4071-85ef-ec564cdcf7d4;2130152880;213001001;;1152130004740;;79623210353;;1010078582;;ТОВАРИЩЕСТВО СОБСТВЕННИКОВ НЕДВИЖИМОСТИ ТОВАРИЩЕСТВО СОБСТВЕННИКОВ ЖИЛЬЯ НА СКЛАДСКОМ;tsn210353@yandex.ru;ТСН ТСЖ НА СКЛАДСКОМ;428022, ЧУВАШИЯ ЧУВАШСКАЯ РЕСПУБЛИКА -, ГОРОД ЧЕБОКСАРЫ, ПРОЕЗД СКЛАДСКОЙ, д. ДОМ 8, кв. КВАРТИРА 45;Масланова;Татьяна;Геннадьевна;L
412;e929c07f-6a7d-4cc2-b71f-0b3313c74c77;2113003454;211301001;http://gov.cap.ru/Default.aspx?gov_id=445&unit=contact;1052138008042;;+7(83543)31221;;1007361483;;АДМИНИСТРАЦИЯ СИЯВСКОГО СЕЛЬСКОГО ПОСЕЛЕНИЯ;porezk_sao-siyav@cap.ru;АДМИНИСТРАЦИЯ СИЯВСКОГО СЕЛЬСКОГО ПОСЕЛЕНИЯ;429031, Чувашская Республика Чувашия, Порецкий р-н, с Сиява, ул Ленина, д. 104;Колосова;Татьяна;Николаевна;A
413;505e3815-d038-4d4a-9d36-2642a68a60e2;2106006535;210601001;http://gov.cap.ru/main.asp?govid=348/;1052134014360;;79033014233;;1011950177;;АДМИНИСТРАЦИЯ КОШНОРУЙСКОГО СЕЛЬСКОГО ПОСЕЛЕНИЯ КАНАШСКОГО РАЙОНА ЧУВАШСКОЙ РЕСПУБЛИКИ;kan-koshnor@cap.ru;АДМИНИСТРАЦИЯ КОШНОРУЙСКОГО СЕЛЬСКОГО ПОСЕЛЕНИЯ КАНАШСКОГО РАЙОНА ЧУВАШСКОЙ РЕСПУБЛИКИ;429315, ЧУВАШИЯ ЧУВАШСКАЯ РЕСПУБЛИКА -, РАЙОН КАНАШСКИЙ, ДЕРЕВНЯ КОШНОРУЙ, УЛИЦА ЛЕНИНА, д. 35;Максимов;Владимир;Иванович;A
414;6d461795-714c-418e-a50e-375f2af6a6e6;2116815655;211601001;http://gov.cap.ru/default.aspx?gov_id=489;1052135017439;;8(83540)2-16-01;;1008850953;;АДМИНИСТРАЦИЯ ЛАПСАРСКОГО СЕЛЬСКОГО ПОСЕЛЕНИЯ ЧЕБОКСАРСКОГО РАЙОНА ЧУВАШСКОЙ РЕСПУБЛИКИ;cha_lap@cap.ru;АДМИНИСТРАЦИЯ ЛАПСАРСКОГО СЕЛЬСКОГО ПОСЕЛЕНИЯ ЧЕБОКСАРСКОГО РАЙОНА ЧУВАШСКОЙ РЕСПУБЛИКИ;428903, ЧУВАШИЯ ЧУВАШСКАЯ РЕСПУБЛИКА -, Р-Н ЧЕБОКСАРСКИЙ, Д СЯТРАКАСЫ (ЛАПСАРСКОГО С/П), УЛ ЦЕНТРАЛЬНАЯ, д. 3;Иванов;Алексей;Викторович;A
415;d4a6f4fc-ba11-48d7-9deb-d01e2ef165d2;2127324514;213001001;http://www.jkh.cap.ru/page/orgs/org/152;1032127003215;{'code': '10', 'guid': '341e8e55-4f2e-4ecc-ba90-61d4e58bd4a9', 'name': None, 'level': None, 'actual': None, 'parent': None, 'status': None, 'updDate': None, 'createDate': None, 'hasChildren': None, 'lastUpdateDate': None, 'rootEntityGuid': None};79279978956;;1006875905;;ТОВАРИЩЕСТВО СОБСТВЕННИКОВ ЖИЛЬЯ ВОЛГА-9;505408@mail.ru;ТСЖ Волга-9;428026, ЧУВАШИЯ ЧУВАШСКАЯ РЕСПУБЛИКА -, ГОРОД ЧЕБОКСАРЫ, УЛИЦА РОЗЫ ЛЮКСЕМБУРГ, д. 9;Булаткин;Юрий;Иванович;L
416;91aa17fa-3b96-4756-9193-17237f440ce2;2113003302;211301001;http://gov.cap.ru/Default.aspx?gov_id=440&unit=contact;1052138008196;;78354342223;;1015099402;;АДМИНИСТРАЦИЯ НИКУЛИНСКОГО СЕЛЬСКОГО ПОСЕЛЕНИЯ;porezk_sao-niku@cap.ru;АДМИНИСТРАЦИЯ НИКУЛИНСКОГО СЕЛЬСКОГО ПОСЕЛЕНИЯ;429027, ЧУВАШИЯ ЧУВАШСКАЯ РЕСПУБЛИКА -, РАЙОН ПОРЕЦКИЙ, СЕЛО НИКУЛИНО, УЛИЦА НИКОЛАЕВА, д. 35;Васильев;Григорий;Леонидович;A
417;54353b59-f8f3-4005-82e4-52443bac14c7;2113003341;211301001;http://gov.cap.ru/Default.aspx?gov_id=438;1052138008152;;+7(83543)35219;;1007250248;;АДМИНИСТРАЦИЯ МИШУКОВСКОГО СЕЛЬСКОГО ПОСЕЛЕНИЯ;porezk_sao-mish@cap.ru;АДМИНИСТРАЦИЯ МИШУКОВСКОГО СЕЛЬСКОГО ПОСЕЛЕНИЯ;429023, ЧУВАШИЯ ЧУВАШСКАЯ РЕСПУБЛИКА -, РАЙОН ПОРЕЦКИЙ, СЕЛО МИШУКОВО, УЛИЦА СЕВЕРНАЯ, д. 1, к. А;Конов;Алексей;Иванович;A
418;74c8cd5f-4f8c-433a-8d22-3c38683863a9;2119901285;211901001;;1052136009243;;+7(83547)60636;;1009027091;;АДМИНИСТРАЦИЯ  ЯДРИНСКОГО СЕЛЬСКОГО ПОСЕЛЕНИЯ  ЯДРИНСКОГО РАЙОНА ЧУВАШСКОЙ РЕСПУБЛИКИ;sao-yadrino@yadrin.cap.ru;АДМИНИСТРАЦИЯ  ЯДРИНСКОГО СЕЛЬСКОГО ПОСЕЛЕНИЯ  ЯДРИНСКОГО РАЙОНА ЧУВАШСКОЙ РЕСПУБЛИКИ;429061, Чувашская Республика Чувашия, Ядринский р-н, с Ядрино, ул Шоссейная, д. 1;Абрамов;Виталий;Олегович;A
419;3f18e6e1-cacc-4e75-93e9-4b5e84e8b063;2113003479;211301001;http://gov.cap.ru/default.aspx?gov_id=437&unit=contact;1052138008020;;+7(83543)23229;;1009487527;;АДМИНИСТРАЦИЯ КУДЕИХИНСКОГО СЕЛЬСКОГО ПОСЕЛЕНИЯ;porezk_sao-cud@cap.ru;АДМИНИСТРАЦИЯ КУДЕИХИНСКОГО СЕЛЬСКОГО ПОСЕЛЕНИЯ;429030, ЧУВАШИЯ ЧУВАШСКАЯ РЕСПУБЛИКА -, РАЙОН ПОРЕЦКИЙ, СЕЛО КУДЕИХА, УЛИЦА КРАСНАЯ ПЛОЩАДЬ, д. 1, к. А;Селиверстов;Анатолий;Николаевич;A
420;292d6c9c-ccbf-40f9-8371-5cf39c8cba6d;2113003246;211301001;http://gov.cap.ru/default.aspx?gov_id=436;1052138008262;;+7(83543)43216;;1015320924;;АДМИНИСТРАЦИЯ КОЗЛОВСКОГО СЕЛЬСКОГО ПОСЕЛЕНИЯ;porezk_sao-kozl@cap.ru;АДМИНИСТРАЦИЯ КОЗЛОВСКОГО СЕЛЬСКОГО ПОСЕЛЕНИЯ;429028, ЧУВАШИЯ ЧУВАШСКАЯ РЕСПУБЛИКА -, РАЙОН ПОРЕЦКИЙ, СЕЛО КОЗЛОВКА, УЛИЦА ШКОЛЬНАЯ, д. 190;Андреев;Аркадий;Иванович;A
421;034155bb-349d-4725-aef9-c1bd9b3514d9;2106006380;210601001;http://gov.cap.ru/?gov_id=344;1052134014217;;8353360351;;1009841530;;АДМИНИСТРАЦИЯ АЧАКАСИНСКОГО СЕЛЬСКОГО ПОСЕЛЕНИЯ КАНАШСКОГО РАЙОНА ЧУВАШСКОЙ РЕСПУБЛИКИ;sao-achakas@kanash.cap.ru;АДМИНИСТРАЦИЯ АЧАКАСИНСКОГО СЕЛЬСКОГО ПОСЕЛЕНИЯ КАНАШСКОГО РАЙОНА ЧУВАШСКОЙ РЕСПУБЛИКИ;429345, ЧУВАШИЯ ЧУВАШСКАЯ РЕСПУБЛИКА -, Р-Н КАНАШСКИЙ, Д НОВЫЕ АЧАКАСЫ, УЛ МОЛОДЕЖНАЯ, д. 21;Аввакумов;Анатолий;Михайлович;A
422;f281f4a0-1940-4247-ab99-cd55e0e2f257;2129019763;213001001;;1082130004406;;78352456618;;1014081624;;ЖИЛИЩНО-СТРОИТЕЛЬНЫЙ КООПЕРАТИВ ФАКЕЛ;GOGSK@RAMBLER.RU;ЖСК ФАКЕЛ;428006, Чувашская Республика Чувашия, г Чебоксары, ул Промышленная, д. 2;Васильева;Маргарита;Всеволодовна;L
423;bd1973ab-f251-4eff-a249-44b67f9d45cc;2130126713;213001001;нет;1132130013443;;78352501920;;1050372863;;ТОВАРИЩЕСТВО СОБСТВЕННИКОВ ЖИЛЬЯ КОМПЛЕКС;tszh.Komplex@gmail.com;ТСЖ КОМПЛЕКС;428031, ЧУВАШИЯ ЧУВАШСКАЯ РЕСПУБЛИКА -, ГОРОД ЧЕБОКСАРЫ, УЛИЦА ПРОЛЕТАРСКАЯ, д. 16;Нянина;Ираида;Константиновна;L
424;d658ce1c-7aaf-4510-8812-e5775637899c;2130119755;213001001;;1132130006491;;79176518908;;1013326611;;ТОВАРИЩЕСТВО СОБСТВЕННИКОВ ЖИЛЬЯЗАБОТА;zabota16к2@mail.ru;ТСЖЗАБОТА;428031, ЧУВАШИЯ ЧУВАШСКАЯ РЕСПУБЛИКА -, ГОРОД ЧЕБОКСАРЫ, УЛИЦА ПРОЛЕТАРСКАЯ, д. 16, к. 2;Бобров;Александр;Викторович;L
425;51b09888-5c21-4850-bbc9-044bab1f370d;2130102751;213001001;http://www.jkh.cap.ru/page/orgs/org/642;1122130005326;;78352622223;;1011452983;;ОБЩЕСТВО С ОГРАНИЧЕННОЙ ОТВЕТСТВЕННОСТЬЮ АЛЬЯНС ЖИЛКОМ;vamosolkov@mail.ru;ООО АЛЬЯНС ЖИЛКОМ;428003, Чувашская Республика Чувашия, г Чебоксары, ул Николая Ильбекова, д. 4;Мосолков;Владимир;Александрович;L
426;1a638934-567c-4d01-b4da-941f39e2c7c3;2116815662;211601001;http://gov.cap.ru/?gov_id=492;1052135017440;;+7(83540)29506;;1007934631;;АДМИНИСТРАЦИЯ СИНЬЯЛ-ПОКРОВСКОГО СЕЛЬСКОГО ПОСЕЛЕНИЯ ЧЕБОКСАРСКОГО РАЙОНА ЧУВАШСКОЙ РЕСПУБЛИКИ;cha_spa@cap.ru;АДМИНИСТРАЦИЯ СИНЬЯЛ-ПОКРОВСКОГО СЕЛЬСКОГО ПОСЕЛЕНИЯ ЧЕБОКСАРСКОГО РАЙОНА ЧУВАШСКОЙ РЕСПУБЛИКИ;429520, ЧУВАШИЯ ЧУВАШСКАЯ РЕСПУБЛИКА -, РАЙОН ЧЕБОКСАРСКИЙ, ДЕРЕВНЯ ПАРХИКАСЫ, УЛИЦА САДОВАЯ, д. 1;Васильев;Рудольф;Валерианович;A
427;559ee7d8-44e6-4d34-ba15-a775b7ac2aee;2123012240;212301001;;1112134000615;;8(83533) 23009;;1000330723;;АКЦИОНЕРНОЕ ОБЩЕСТВО КАНАШСКАЯ ГОРОДСКАЯ ЯРМАРКА;kangorrun@yandex/ru;АО КАНАШСКАЯ ГОРОДСКАЯ ЯРМАРКА;429330, ЧУВАШИЯ ЧУВАШСКАЯ РЕСПУБЛИКА -, ГОРОД КАНАШ, УЛИЦА МОСКОВСКАЯ, д. 13;Никитин;Евгений;Григорьевич;L
428;aa51bee4-59be-48fd-bcfc-4f5050a05c82;2130090778;213001001;;1112130009144;{'code': '16', 'guid': '0791a19d-f8ca-4162-8ff8-075a5ed847cf', 'name': None, 'level': None, 'actual': None, 'parent': None, 'status': None, 'updDate': None, 'createDate': None, 'hasChildren': None, 'lastUpdateDate': None, 'rootEntityGuid': None};+78352569101;;1006612622;;ОБЩЕСТВО С ОГРАНИЧЕННОЙ ОТВЕТСТВЕННОСТЬЮ УПРАВЛЯЮЩАЯ КОМПАНИЯ СВОЙ ДВОР;uk_svojdvor2011@mail.ru;ООО УК СВОЙ ДВОР;428022, Чувашская Республика Чувашия, г Чебоксары, ул Гагарина Ю., д. 30, к. 1, кв. 2;Иванова;Надежда;Леонидовна;L
429;9f2c7c84-8712-495f-8076-7c38a8103a58;2123010980;212301001;;1092134000276;;89379552631;;1009866133;;ТОВАРИЩЕСТВО СОБСТВЕННИКОВ ЖИЛЬЯ ВОСХОД;tszh.vosxod@yandex.ru;ТСЖ ВОСХОД;429335, Чувашская Республика Чувашия, г Канаш, ул Железнодорожная, д. 89;Кузнецов;Александр;Сергеевич;L
