id;guid;inn;kpp;url;ogrn;okfs;phone;ogrnip;orgOid;bankCode;fullName;orgEmail;shortName;orgAddress;chiefLastName;chiefFirstName;chiefMiddleName;organizationType
529;094e8030-e2d5-4f2c-bc75-90de6adc8939;2112389445;211201001;http://gov.cap.ru/Default.aspx?gov_id=421&unit=contact;1052136009815;;8(83541) 66-7-33;;1007296100;;АДМИНИСТРАЦИЯ ИЛЬИНСКОГО СЕЛЬСКОГО ПОСЕЛЕНИЯ МОРГАУШСКОГО РАЙОНА ЧР;mrgilin_pos@cbx.ru;АДМИНИСТРАЦИЯ ИЛЬИНСКОГО СЕЛЬСКОГО ПОСЕЛЕНИЯ МОРГАУШСКОГО РАЙОНА ЧР;429545, Чувашская Республика Чувашия, Моргаушский р-н, д Тренькино, ул Новая, д. 5;Соколова;Марина;Вячеславовна;A
530;96e47c4a-89d0-422b-bc60-4751a8948585;2106006454;210601001;http://gov.cap.ru/;1052134014283;;79876633638;;1009631424;;АДМИНИСТРАЦИЯ МАЛОКИБЕЧСКОГО СЕЛЬСКОГО ПОСЕЛЕНИЯ КАНАШСКОГО РАЙОНА ЧУВАШСКОЙ РЕСПУБЛИКИ;kan-mkibech@cap.ru;АДМИНИСТРАЦИЯ МАЛОКИБЕЧСКОГО СЕЛЬСКОГО ПОСЕЛЕНИЯ КАНАШСКОГО РАЙОНА ЧУВАШСКОЙ РЕСПУБЛИКИ;429307, ЧУВАШИЯ ЧУВАШСКАЯ РЕСПУБЛИКА -, РАЙОН КАНАШСКИЙ, СЕЛО МАЛЫЕ КИБЕЧИ, УЛИЦА МИХАИЛА ГЕОРГИЕВА, д. 2;Иванов;Владимир;Кузьмич;A
531;b446f8a9-e7d1-4bdd-96f1-e78cd7f9f219;2112389491;211201001;http://gov.cap.ru/Default.aspx?gov_id=424;1052136009782;;+7(83541)66285;;1007321547;;АДМИНИСТРАЦИЯ МОСКАКАСИНСКОГО СЕЛЬСКОГО ПОСЕЛЕНИЯ МОРГАУШСКОГО РАЙОНА ЧУВАШСКОЙ РЕСПУБЛИКИ;moskakas@cap.ru;АДМИНИСТРАЦИЯ МОСКАКАСИНСКОГО СЕЛЬСКОГО ПОСЕЛЕНИЯ МОРГАУШСКОГО РАЙОНА ЧР;429540, ЧУВАШИЯ ЧУВАШСКАЯ РЕСПУБЛИКА -, РАЙОН МОРГАУШСКИЙ, ДЕРЕВНЯ МОСКАКАСЫ, УЛИЦА МОСКОВСКАЯ, д. 54;Кириллов;Денис;Валерьевич;A
532;df590669-74ff-4153-9888-280611e5647f;2102421428;210201001;;1082133000278;;;;1000307379;;ОБЩЕСТВО С ОГРАНИЧЕННОЙ ОТВЕТСТВЕННОСТЬЮ УПРАВЛЯЮЩАЯ КОМПАНИЯ ЖИЛИЩЕ;alik_twk@cbx.ru;ООО Управляющая компания Жилище;429250, Чувашская Республика Чувашия, Аликовский р-н, с Аликово, ул Гагарина, д. 24;Егоров;Алексей;Михайлович;L
533;cf2a2048-21ca-4401-812a-83737bcb4cc6;2101004862;210101001;;1052131012515;;+7(83531)63044;;1030318543;;АДМИНИСТРАЦИЯ ЧУВАРЛЕЙСКОГО СЕЛЬСКОГО ПОСЕЛЕНИЯ АЛАТЫРСКОГО РАЙОНА ЧУВАШСКОЙ РЕСПУБЛИКИ;sao-chuvarl@alatr.cap.ru;АДМИНИСТРАЦИЯ ЧУВАРЛЕЙСКОГО СЕЛЬСКОГО ПОСЕЛЕНИЯ АЛАТЫРСКОГО РАЙОНА ЧУВАШСКОЙ РЕСПУБЛИКИ;429810, ЧУВАШИЯ ЧУВАШСКАЯ РЕСПУБЛИКА -, РАЙОН АЛАТЫРСКИЙ, СЕЛО ЧУВАРЛЕИ, УЛИЦА ВОРОШИЛОВА, д. 144;Климкин;Николай;Васильевич;A
534;fbbc413d-cffb-4ef3-bd6b-20840d081e0f;2105002182;210501001;www.ibresi.cap.ru;1022102029949;;+78353821218;;1007191594;;АДМИНИСТРАЦИЯ ИБРЕСИНСКОГО РАЙОНА ЧУВАШСКОЙ РЕСПУБЛИКИ;ibresi@cap.ru;АДМИНИСТРАЦИЯ ИБРЕСИНСКОГО РАЙОНА ЧУВАШСКОЙ РЕСПУБЛИКИ;429700, ЧУВАШИЯ ЧУВАШСКАЯ РЕСПУБЛИКА -, РАЙОН ИБРЕСИНСКИЙ, ПОСЕЛОК ГОРОДСКОГО ТИПА ИБРЕСИ, УЛИЦА МАРЕСЬЕВА, д. 49;Горбунов;Сергей;Валерьевич;A
535;6d4649ac-2369-46fa-acc1-62c73c6f06f5;2116491707;211601001;;1022102432186;;88354025649;;1011721342;;ОБЩЕСТВО С ОГРАНИЧЕННОЙ ОТВЕТСТВЕННОСТЬЮ ИШЛЕЙСКИЙ ЗАВОД ВЫСОКОВОЛЬТНОЙ АППАРАТУРЫ;izva@izva.ru;ООО ИЗВА;429520, ЧУВАШИЯ ЧУВАШСКАЯ РЕСПУБЛИКА -, РАЙОН ЧЕБОКСАРСКИЙ, СЕЛО ИШЛЕИ, УЛИЦА СОВЕТСКАЯ, д. 53;Шурдов;Алексей;Михайлович;L
536;e70bdce1-eb7c-4b33-80b2-5740da7914eb;2108007245;210801001;;1082132000048;;7 (835) 395-11-30;;1000315779;;ОБЩЕСТВО С ОГРАНИЧЕННОЙ ОТВЕТСТВЕННОСТЬЮ КОММУНАЛЬНЫЙ СЕРВИС;kom_gkh@cbx.ru;ООО Коммунальный сервис;429140, ЧУВАШИЯ ЧУВАШСКАЯ РЕСПУБЛИКА -, РАЙОН КОМСОМОЛЬСКИЙ, СЕЛО КОМСОМОЛЬСКОЕ, УЛИЦА ЗАВОДСКАЯ, д. 41;Макаров;Сергей;Николаевич;L
537;8ba5381c-c323-4fa8-ba9e-ac5daa3c5c8b;2110001240;211001001;www.krchet.cap.ru;1022102633486;;+7(83551)21661;;1006111573;;АДМИНИСТРАЦИЯ КРАСНОЧЕТАЙСКОГО РАЙОНА ЧУВАШСКОЙ РЕСПУБЛИКИ;smev@krchet.cap.ru;АДМИНИСТРАЦИЯ КРАСНОЧЕТАЙСКОГО РАЙОНА ЧУВАШСКОЙ РЕСПУБЛИКИ;429040, Чувашская Республика Чувашия, Красночетайский р-н, с Красные Четаи, пл Победы, д. 1;Башкиров;Александр;Викторович;A
538;a91bf402-4bdc-4ae7-bdc6-7a21ef1611e7;2101004855;210101001;http://gov.cap.ru/Structure.aspx?gov_id=275;1052131012504;;+7(83531) 64-005;;1035921238;;АДМИНИСТРАЦИЯ ПЕРВОМАЙСКОГО СЕЛЬСКОГО ПОСЕЛЕНИЯ АЛАТЫРСКОГО РАЙОНА ЧУВАШСКОЙ РЕСПУБЛИКИ;pervomaj_alatr@cap.ru;АДМИНИСТРАЦИЯ ПЕРВОМАЙСКОГО СЕЛЬСКОГО ПОСЕЛЕНИЯ АЛАТЫРСКОГО РАЙОНА ЧУВАШСКОЙ РЕСПУБЛИКИ;429806, Чувашская Республика Чувашия, Алатырский р-н, п Первомайский, ул Ленина, д. 46;Смолин;Александр;Михайлович;A
539;fe5f971b-49fc-4837-a8bd-f0627b81f5fd;2101004799;210101001;mezhdurech_alatr@cap.ru;1052131012449;;+7(83531) 65-344;;1035068159;;АДМИНИСТРАЦИЯ МЕЖДУРЕЧЕНСКОГО СЕЛЬСКОГО ПОСЕЛЕНИЯ АЛАТЫРСКОГО РАЙОНА ЧУВАШСКОЙ РЕСПУБЛИКИ;mezhdurech_alatr@cap.ru;АДМИНИСТРАЦИЯ МЕЖДУРЕЧЕНСКОГО СЕЛЬСКОГО ПОСЕЛЕНИЯ АЛАТЫРСКОГО РАЙОНА ЧУВАШСКОЙ РЕСПУБЛИКИ;429814, ЧУВАШИЯ ЧУВАШСКАЯ РЕСПУБЛИКА -, РАЙОН АЛАТЫРСКИЙ, СЕЛО МЕЖДУРЕЧЬЕ, УЛИЦА 50 ЛЕТ ЧАССР, д. 14;Логинов;Алексей;Михайлович;A
540;b679ce60-0ac0-43bc-a9ca-5fe796792837;2101004870;210101001;;1052131012526;;+7(83531) 64-201;;1035255558;;АДМИНИСТРАЦИЯ СТЕМАССКОГО СЕЛЬСКОГО ПОСЕЛЕНИЯ АЛАТЫРСКОГО РАЙОНА ЧУВАШСКОЙ РЕСПУБЛИКИ;sao-stemas@alatr.cap.ru;АДМИНИСТРАЦИЯ СТЕМАССКОГО СЕЛЬСКОГО ПОСЕЛЕНИЯ АЛАТЫРСКОГО РАЙОНА ЧУВАШСКОЙ РЕСПУБЛИКИ;429802, Чувашская Республика Чувашия, Алатырский р-н, с Стемасы, ул Ленина, д. 122;Душев;Михаил;Сергеевич;A
541;a6387b85-6b32-4d60-8806-e4487a9e5f09;2106006581;210601001;http://gov.cap.ru/main.asp?govid=365/;1052134014624;;+7(83533)61702;;1009630985;;АДМИНИСТРАЦИЯ ЯНГЛИЧСКОГО СЕЛЬСКОГО ПОСЕЛЕНИЯ КАНАШСКОГО РАЙОНА ЧУВАШСКОЙ РЕСПУБЛИКИ;kan-janglich@cap.ru;АДМИНИСТРАЦИЯ ЯНГЛИЧСКОГО СЕЛЬСКОГО ПОСЕЛЕНИЯ КАНАШСКОГО РАЙОНА ЧУВАШСКОЙ РЕСПУБЛИКИ;429346, ЧУВАШИЯ ЧУВАШСКАЯ РЕСПУБЛИКА -, Р-Н КАНАШСКИЙ, С ЯНГЛИЧИ, УЛ ЛЕНИНА, д. 88;Савельева;Галина;Георгиевна;A
542;a78856a0-81ef-4ee2-ac3b-719096bfc6b0;2105004091;210501001;http://gov.cap.ru/Default.aspx?gov_id=333;1052133019267;;78353826232;;1007879418;;АДМИНИСТРАЦИЯ БУИНСКОГО СЕЛЬСКОГО ПОСЕЛЕНИЯ ИБРЕСИНСКОГО РАЙОНА ЧУВАШСКОЙ РЕСПУБЛИКИ;ibrbuinsk-adm@cap.ru;АДМИНИСТРАЦИЯ БУИНСКОГО СЕЛЬСКОГО ПОСЕЛЕНИЯ ИБРЕСИНСКОГО РАЙОНА ЧУВАШСКОЙ РЕСПУБЛИКИ;429720, ЧУВАШИЯ ЧУВАШСКАЯ РЕСПУБЛИКА -, РАЙОН ИБРЕСИНСКИЙ, ПОСЕЛОК ГОРОДСКОГО ТИПА БУИНСК, УЛИЦА КАЛИНИНА, д. 28;Киргинцева;Зылхабиря;Кашафовна;A
543;ecd512dd-bcc7-4036-8a66-be5f341d4175;2115903235;211501001;http://gov.cap.ru/Default.aspx?gov_id=479;1052137022222;;+7(83545)60255;;1000323453;;АДМИНИСТРАЦИЯ ЧУРАЧИКСКОГО СЕЛЬСКОГО ПОСЕЛЕНИЯ ЦИВИЛЬСКОГО РАЙОНА ЧУВАШСКОЙ РЕСПУБЛИКИ;sao-shur@zivil.cap.ru;АДМИНИСТРАЦИЯ ЧУРАЧИКСКОГО СЕЛЬСКОГО ПОСЕЛЕНИЯ;429914, Чувашская Республика Чувашия, Цивильский р-н, с Чурачики, ул Ленина, д. 21;Петров;Александр;Гурьевич;A
544;dee2ea49-ebb7-4654-8c74-49f503dc7538;2101004936;210101001;;1052131012581;;+7(83531) 65-445;;1036114306;;АДМИНИСТРАЦИЯ СТАРОАЙБЕСИНСКОГО СЕЛЬСКОГО ПОСЕЛЕНИЯ АЛАТЫРСКОГО РАЙОНА ЧУВАШСКОЙ РЕСПУБЛИКИ;sao-staraibes@alatr.cap.ru;АДМИНИСТРАЦИЯ СТАРОАЙБЕСИНСКОГО СЕЛЬСКОГО ПОСЕЛЕНИЯ АЛАТЫРСКОГО РАЙОНА ЧУВАШСКОЙ РЕСПУБЛИКИ;429807, Чувашская Республика Чувашия, Алатырский р-н, с Старые Айбеси, ул Школьная, д. 5;Казанцев;Василий;Петрович;A
545;e6fe7a24-b630-4d85-a068-2aaf3a647165;2106006493;210601001;http://gov.cap.ru/main.asp?govid=351;1052134014327;;8353363315;;1015233752;;АДМИНИСТРАЦИЯ НОВОУРЮМОВСКОГО СЕЛЬСКОГО ПОСЕЛЕНИЯ КАНАШСКОГО РАЙОНА ЧУВАШСКОЙ РЕСПУБЛИКИ;kan-nurjum@cap.ru;АДМИНИСТРАЦИЯ НОВОУРЮМОВСКОГО СЕЛЬСКОГО ПОСЕЛЕНИЯ КАНАШСКОГО РАЙОНА ЧУВАШСКОЙ РЕСПУБЛИКИ;429325, Чувашская Республика Чувашия, Канашский р-н, д Новое Урюмово, ул Кооперативная;Степанов;Андрей;Васильевич;A
546;94824703-ba4c-4d42-8240-e67c6deb783b;2101004929;210101001;http://gov.cap.ru/Default.aspx?gov_id=268;1052131012570;;+7(83531) 63706;;1035901947;;АДМИНИСТРАЦИЯ ИВАНЬКОВО-ЛЕНИНСКОГО СЕЛЬСКОГО ПОСЕЛЕНИЯ АЛАТЫРСКОГО РАЙОНА ЧУВАШСКОЙ РЕСПУБЛИКИ;ivankov_alatr@cap.ru;АДМИНИСТРАЦИЯ ИВАНЬКОВО-ЛЕНИНСКОГО СЕЛЬСКОГО ПОСЕЛЕНИЯ АЛАТЫРСКОГО РАЙОНА ЧУВАШСКОЙ РЕСПУБЛИКИ;429803, Чувашская Республика Чувашия, Алатырский р-н, с Иваньково-Ленино, ул Октябрьская, д. 1А;Шугуров;Валентин;Геннадьевич;A
547;db1007c4-57a5-41f1-8e4d-a50cc8c5ee05;2101004904;210101001;;1052131012559;;+7(83531) 63-483;;1035111493;;АДМИНИСТРАЦИЯ НОВОАЙБЕСИНСКОГО СЕЛЬСКОГО ПОСЕЛЕНИЯ АЛАТЫРСКОГО РАЙОНА ЧУВАШСКОЙ РЕСПУБЛИКИ;sao-newaibes@alatr.cap.ru;АДМИНИСТРАЦИЯ НОВОАЙБЕСИНСКОГО СЕЛЬСКОГО ПОСЕЛЕНИЯ АЛАТЫРСКОГО РАЙОНА ЧУВАШСКОЙ РЕСПУБЛИКИ;429808, Чувашская Республика Чувашия, Алатырский р-н, с Новые Айбеси, ул Ленина, д. 34;ИЛЮШКИН;НИКОЛАЙ;ВЛАДИМИРОВИЧ;A
548;5f08d9f7-bc1e-4d00-9ae6-e069b2bc7eff;0224009480;022401001;;1060224010054;;+7(34795)23208;;1000309784;;МУНИЦИПАЛЬНОЕ УНИТАРНОЕ ПРЕДПРИЯТИЕ ВОДОКАНАЛ;myp_vk@mail.ru;МУП Водоканал;452410, Респ Башкортостан, Иглинский р-н, с Иглино, ул Революционная, д. 26;Чаркин;Анатолий;Дмитриевич;L
549;31550f4f-541a-4570-a003-4fa6caf0dd22;2110051876;211001001;;1052136009760;;+7(83551)21253;;1017729420;;АДМИНИСТРАЦИЯ КРАСНОЧЕТАЙСКОГО СЕЛЬСКОГО ПОСЕЛЕНИЯ КРАСНОЧЕТАЙСКОГО РАЙОНА ЧУВАШСКОЙ РЕСПУБЛИКИ;sao-krchet@krchet.cap.ru;АДМИНИСТРАЦИЯ КРАСНОЧЕТАЙСКОГО СЕЛЬСКОГО ПОСЕЛЕНИЯ КРАСНОЧЕТАЙСКОГО РАЙОНА ЧУВАШСКОЙ РЕСПУБЛИКИ;429040, ЧУВАШИЯ ЧУВАШСКАЯ РЕСПУБЛИКА -, РАЙОН КРАСНОЧЕТАЙСКИЙ, СЕЛО КРАСНЫЕ ЧЕТАИ, ПЛОЩАДЬ ПОБЕДЫ, д. 9;Волков;Анатолий;Геннадьевич;A
550;571629f6-d374-4438-850b-20e017f58f8a;2101004848;210101001;http://gov.cap.ru/Default.aspx?gov_id=264;1052131012493;;+7(83531) 64609;;1035854654;;АДМИНИСТРАЦИЯ АЛТЫШЕВСКОГО СЕЛЬСКОГО ПОСЕЛЕНИЯ АЛАТЫРСКОГО РАЙОНА ЧУВАШСКОЙ РЕСПУБЛИКИ;sao-altish@alatr.cap.ru;АДМИНИСТРАЦИЯ АЛТЫШЕВСКОГО СЕЛЬСКОГО ПОСЕЛЕНИЯ АЛАТЫРСКОГО РАЙОНА ЧУВАШСКОЙ РЕСПУБЛИКИ;429851, Чувашская Республика Чувашия, Алатырский р-н, с Алтышево, ул Октябрьская, д. 2Б;Кедяров;Валентин;Иванович;A
551;984964de-8f49-48df-aa2c-0a33eb5691f2;2101004816;210101001;;1052131012460;;+7(83531)65-633;;1035815900;;АДМИНИСТРАЦИЯ МИРЕНСКОГО СЕЛЬСКОГО ПОСЕЛЕНИЯ АЛАТЫРСКОГО РАЙОНА ЧУВАШСКОЙ РЕСПУБЛИКИ;sao-miren@alatr.cap.ru;АДМИНИСТРАЦИЯ МИРЕНСКОГО СЕЛЬСКОГО ПОСЕЛЕНИЯ АЛАТЫРСКОГО РАЙОНА ЧУВАШСКОЙ РЕСПУБЛИКИ;429811, Чувашская Республика Чувашия, Алатырский р-н, с Миренки, ул Советская 2-я, д. 42;Беленьков;Геннадий;Иванович;A
552;4830a2a9-9925-40be-a3bd-5a3f4f3ed722;2105004045;210501001;http://gov.cap.ru/Default.aspx?gov_id=334;1052133019091;;+78353821235;;1007890142;;АДМИНИСТРАЦИЯ ИБРЕСИНСКОГО ГОРОДСКОГО ПОСЕЛЕНИЯ ИБРЕСИНСКОГО РАЙОНА ЧУВАШСКОЙ РЕСПУБЛИКИ;ibresi-adm@ibresi.cap.ru;АДМИНИСТРАЦИЯ ИБРЕСИНСКОГО ГОРОДСКОГО ПОСЕЛЕНИЯ ИБРЕСИНСКОГО РАЙОНА ЧУВАШСКОЙ РЕСПУБЛИКИ;429700, ЧУВАШИЯ ЧУВАШСКАЯ РЕСПУБЛИКА -, РАЙОН ИБРЕСИНСКИЙ, ПОСЕЛОК ГОРОДСКОГО ТИПА ИБРЕСИ, УЛИЦА КОМСОМОЛЬСКАЯ, д. ДОМ 13;Фадеев;Сергей;Павлович;A
553;a53755bc-aed9-44a6-a4d7-9bc5777e8d68;2106006422;210601001;http://gov.cap.ru/?gov_id=345;1052134014250;;79656825295;;1013170840;;АДМИНИСТРАЦИЯ БАЙГИЛЬДИНСКОГО СЕЛЬСКОГО ПОСЕЛЕНИЯ КАНАШСКОГО РАЙОНА ЧУВАШСКОЙ РЕСПУБЛИКИ;kan-bajgild@cap.ru;АДМИНИСТРАЦИЯ БАЙГИЛЬДИНСКОГО СЕЛЬСКОГО ПОСЕЛЕНИЯ КАНАШСКОГО РАЙОНА ЧУВАШСКОЙ РЕСПУБЛИКИ;429308, Чувашская Республика Чувашия, Канашский р-н, д Байгильдино, ул Волкова, д. 31;Воронова;Вероника;Владимировна;A
554;d2f6cd0b-ed27-44e8-91a7-bcfaecc3ddbc;2105006035;210501001;ibrkanal.ru;1162130064986;;8(83538)2-10-18;;1035832656;;ОБЩЕСТВО С ОГРАНИЧЕННОЙ ОТВЕТСТВЕННОСТЬЮ КАНАЛСЕТЬ+;vasevgnik@yandex.ru;ООО КАНАЛСЕТЬ+;429700, ЧУВАШИЯ ЧУВАШСКАЯ РЕСПУБЛИКА -, РАЙОН ИБРЕСИНСКИЙ, ПОСЕЛОК ГОРОДСКОГО ТИПА ПОСЕЛОК ГОРОДСКОГО ТИПА, УЛИЦА МАРЕСЬЕВА, д. ДОМ 36;Семенов;Сергей;Константинович;L
555;0470326c-1a10-4450-aeaa-1e98fda341d2;2105006250;210501001;dom.gosuslugi;1182130013746;;89370170770;;1091669904;;ОБЩЕСТВО С ОГРАНИЧЕННОЙ ОТВЕТСТВЕННОСТЬЮ УПРАВЛЯЮЩАЯ КОМПАНИЯ ВИК;ukibrvik@mail.ru;ООО УК ВИК;429700, ЧУВАШИЯ ЧУВАШСКАЯ РЕСПУБЛИКА -, РАЙОН ИБРЕСИНСКИЙ, ПОСЕЛОК ГОРОДСКОГО ТИПА ИБРЕСИ, УЛИЦА МАРЕСЬЕВА, д. ДОМ 36, кв. ПОМЕЩЕНИЕ 12;Кузьмин;Владимир;Иванович;L
556;bab58cdb-a688-4d94-890b-5b8126e7ae74;2105002961;210501001;dezibresi.ru;1022102029597;{'code': '14', 'guid': '0c3fe855-0dd6-4444-8203-d72f08da341e', 'name': None, 'level': None, 'actual': None, 'parent': None, 'status': None, 'updDate': None, 'createDate': None, 'hasChildren': None, 'lastUpdateDate': None, 'rootEntityGuid': None};+7(83538)21241;;1000308955;;МУНИЦИПАЛЬНОЕ ПРЕДПРИЯТИЕ ДИРЕКЦИЯ ЕДИНОГО ЗАКАЗЧИКА ЖИЛИЩНО-КОММУНАЛЬНОГО ХОЗЯЙСТВА ИБРЕСИНСКОГО РАЙОНА;dez.ibresi@mail.ru;МП ДЕЗ ЖКХ ИБРЕСИНСКОГО РАЙОНА;429700, Чувашская Республика Чувашия, Ибресинский р-н, пгт Ибреси, ул Школьная, д. 6;Киселев;Андрей;Владимирович;L
557;e329edd9-87bb-40d3-ad86-ff6d7c3f5fe7;2105004895;210501001;dom.gosuslugi.ru;1072133000642;{'code': '16', 'guid': '0791a19d-f8ca-4162-8ff8-075a5ed847cf', 'name': None, 'level': None, 'actual': None, 'parent': None, 'status': None, 'updDate': None, 'createDate': None, 'hasChildren': None, 'lastUpdateDate': None, 'rootEntityGuid': None};78353822501;;1000318752;;ОБЩЕСТВО С ОГРАНИЧЕННОЙ ОТВЕТСТВЕННОСТЬЮ УПРАВЛЯЮЩАЯ КОМПАНИЯ;upcompany@mail.ru;ООО УК;429700, ЧУВАШИЯ ЧУВАШСКАЯ РЕСПУБЛИКА -, РАЙОН ИБРЕСИНСКИЙ, ПОСЕЛОК ГОРОДСКОГО ТИПА ИБРЕСИ, УЛИЦА МАРЕСЬЕВА, д. ДОМ 36;Атамова;Наталия;Петровна;L
558;850105fe-21e3-4dfb-b141-7cf0767d3e94;2101004809;210101001;;1052131012450;;+7(83531) 65717;;1035952287;;АДМИНИСТРАЦИЯ КУВАКИНСКОГО СЕЛЬСКОГО ПОСЕЛЕНИЯ АЛАТЫРСКОГО РАЙОНА ЧУВАШСКОЙ РЕСПУБЛИКИ;sao-kuvak@alatr.cap.ru;АДМИНИСТРАЦИЯ КУВАКИНСКОГО СЕЛЬСКОГО ПОСЕЛЕНИЯ АЛАТЫРСКОГО РАЙОНА ЧУВАШСКОЙ РЕСПУБЛИКИ;429812, Чувашская Республика Чувашия, Алатырский р-н, с Кувакино, ул Пролетарская, д. 18;Минеева;Мария;Стефановна;A
559;be4929e4-d416-4498-8bd4-e96e8036b43f;2117000849;211701001;www.shemur.cap.ru;1022101830585;;88354623904;;1006325496;;АДМИНИСТРАЦИЯ ШЕМУРШИНСКОГО РАЙОНА ЧУВАШСКОЙ РЕСПУБЛИКИ;shemur@cap.ru;АДМИНИСТРАЦИЯ ШЕМУРШИНСКОГО РАЙОНА ЧУВАШСКОЙ РЕСПУБЛИКИ;429170, Чувашская Республика Чувашия, Шемуршинский р-н, с Шемурша, ул Советская, д. 8;Денисов;Владимир;Васильевич;A
560;e55e65d5-b49c-40ca-b4e5-af812c348f1e;2117021341;211701001;http://gov.cap.ru/Default.aspx?gov_id=505&unit=contact;1052132013340;;+7(83546)23596;;1009343168;;АДМИНИСТРАЦИЯ ШЕМУРШИНСКОГО СЕЛЬСКОГО ПОСЕЛЕНИЯ ШЕМУРШИНСКОГО РАЙОНА ЧУВАШСКОЙ РЕСПУБЛИКИ;sao-shemursha@cap.ru;АДМИНИСТРАЦИЯ ШЕМУРШИНСКОГО СЕЛЬСКОГО ПОСЕЛЕНИЯ ШЕМУРШИНСКОГО РАЙОНА ЧУВАШСКОЙ РЕСПУБЛИКИ;429170, ЧУВАШИЯ ЧУВАШСКАЯ РЕСПУБЛИКА -, Р-Н ШЕМУРШИНСКИЙ, С ШЕМУРША, УЛ УРУКОВА, д. ДОМ 9, кв. ОФИС 1;Удин;Андрей;Николаевич;A
561;1d60b572-888c-489f-9c68-db111376b547;2101004823;210101001;;1052131012471;;+7(83531)67151;;1052765103;;АДМИНИСТРАЦИЯ КИРСКОГО СЕЛЬСКОГО ПОСЕЛЕНИЯ АЛАТЫРСКОГО РАЙОНА ЧУВАШСКОЙ РЕСПУБЛИКИ;kirskoe_alatr@cap.ru;АДМИНИСТРАЦИЯ КИРСКОГО СЕЛЬСКОГО ПОСЕЛЕНИЯ АЛАТЫРСКОГО РАЙОНА ЧУВАШСКОЙ РЕСПУБЛИКИ;429830, ЧУВАШИЯ ЧУВАШСКАЯ РЕСПУБЛИКА -, Р-Н АЛАТЫРСКИЙ, П КИРЯ, УЛ СИДОРИНА, д. 8;Спиридонов;Виктор;Николаевич;A
562;fe85433d-8582-4b4e-bc8f-8a980b24ef00;2130126537;213001001;http://www.jkh.cap.ru/page/orgs/org/1121;1132130013333;;+7 (835) 270-00-44;;1000382673;;ОБЩЕСТВО С ОГРАНИЧЕННОЙ ОТВЕТСТВЕННОСТЬЮ ТЕПЛОКОМ;teplo.kom21@mail.ru;ООО ТЕПЛОКОМ;428903, ЧУВАШИЯ ЧУВАШСКАЯ РЕСПУБЛИКА -, Г ЧЕБОКСАРЫ, ПР ЛАПСАРСКИЙ, д. ДОМ 57, кв. ПОМЕЩЕНИЕ 8;Кириллов;Виталий;Валерьевич;L
563;a9bf005f-44e4-46ea-bfd6-ef94766c5e16;2116499262;211601001;www.tes.ucoz.org;1102135000263;;(83540)2-13-56;;1000314560;;Общество с ограниченной ответственностью Теплоэнергосеть;teploenergoset@yandex.ru;ООО Теплоэнергосеть;429500, Чувашская Республика Чувашия, Чебоксарский р-н, п Кугеси, ул Шоссейная, д. 3А;Елагин;Николай;Арсентьевич;L
564;10715463-50a8-45eb-ab43-ab7ba8468513;2130062330;213001001;нет;1092130009795;;+7(835) 270-00-44;;1000311874;;ОБЩЕСТВО С ОГРАНИЧЕННОЙ ОТВЕТСТВЕННОСТЬЮ ТЕПЛОСФЕРА;sfera.teplo@mail.ru;ООО ТеплоСфера;428903, ЧУВАШИЯ ЧУВАШСКАЯ РЕСПУБЛИКА -, Г ЧЕБОКСАРЫ, ПР ЛАПСАРСКИЙ, д. ДОМ 57, кв. ПОМЕЩЕНИЕ 8;Фондеркин;Владимир;Александрович;L
565;5d3b1f94-6deb-47f7-b385-19f65a374417;2117021334;211701001;http://gov.cap.ru/main.asp?govid=497/;1052132013339;;78354625446;;1009480546;;АДМИНИСТРАЦИЯ БИЧУРГА-БАИШЕВСКОГО СЕЛЬСКОГО ПОСЕЛЕНИЯ ШЕМУРШИНСКОГО РАЙОНА ЧУВАШСКОЙ РЕСПУБЛИКИ;sao-baishevo@cap.ru;АДМИНИСТРАЦИЯ БИЧУРГА-БАИШЕВСКОГО СЕЛЬСКОГО ПОСЕЛЕНИЯ ШЕМУРШИНСКОГО РАЙОНА ЧУВАШСКОЙ РЕСПУБЛИКИ;429175, Чувашская Республика Чувашия, Шемуршинский р-н, с Бичурга-Баишево, ул Мичурина, д. 5;Угарин;Валерий;Васильевич;A
566;48325e13-ed41-4a0c-9911-78133da42f8b;2110052301;211001001;http://жилсервис21.рф;1082136000077;{'code': '16', 'guid': '0791a19d-f8ca-4162-8ff8-075a5ed847cf', 'name': None, 'level': None, 'actual': None, 'parent': None, 'status': None, 'updDate': None, 'createDate': None, 'hasChildren': None, 'lastUpdateDate': None, 'rootEntityGuid': None};78355121658;;1006580635;;ОБЩЕСТВО С ОГРАНИЧЕННОЙ ОТВЕТСТВЕННОСТЬЮ ЖИЛСЕРВИС;zhilserkrch@mail.ru;ООО ЖИЛСЕРВИС;429040, ЧУВАШИЯ ЧУВАШСКАЯ РЕСПУБЛИКА -, РАЙОН КРАСНОЧЕТАЙСКИЙ, СЕЛО КРАСНЫЕ ЧЕТАИ, УЛИЦА НОВАЯ, д. 51, кв. 19;Селиванов;Владимир;Димитриевич;L
567;c5a2e09b-3355-4cf6-8173-1e2ce7776b58;2117021380;211701001;http://gov.cap.ru/?gov_id=502;1052132013383;;8(83546)-2-66-16;;1009332816;;АДМИНИСТРАЦИЯ ТРЕХБАЛТАЕВСКОГО СЕЛЬСКОГО ПОСЕЛЕНИЯ ШЕМУРШИНСКОГО РАЙОНА ЧУВАШСКОЙ РЕСПУБЛИКИ;soa-baltaevo@cap.ru;АДМИНИСТРАЦИЯ ТРЕХБАЛТАЕВСКОГО СЕЛЬСКОГО ПОСЕЛЕНИЯ ШЕМУРШИНСКОГО РАЙОНА ЧУВАШСКОЙ РЕСПУБЛИКИ;429182, Чувашская Республика Чувашия, Шемуршинский р-н, с Трехбалтаево, ул Школьная, д. 36;Рахматуллов;Феннур;Фазуллович;A
